<!DOCTYPE ip_allocation SYSTEM "ip_allocation.dtd">

 <ip_allocation>
 <network name="admin" function="mn">
  <logical_network name="admin" type="primary" subnet="10.5.0.0/16" gateway="10.5.255.254">
    <range first_ip="10.5.0.1" >
      <member object="node" type="mngt"/>
    </range>
    <range first_ip="10.5.1.1" >
      <member object="node" type="compute"/>
    </range>
    <range first_ip="10.5.100.1" >
      <member object="hwmanager" type="bmc[mngt]"/>
    </range>
    <range first_ip="10.5.101.1" >
      <member object="hwmanager" type="bmc[compute]"/>
    </range>
    <range first_ip="10.5.200.1" >
      <member object="switch"/>
    </range>
  </logical_network>
  </network>
 </ip_allocation>
